productid,bigcategory,subcaregory,productname,price
OFF-ST-10001414,Office Supplies,Storage,Decoflex Hanging Personal Folder File,36.53
OFF-ST-10001418,Office Supplies,Storage,Carina Media Storage Towers in Natural & Black,45.53
OFF-ST-10001469,Office Supplies,Storage,Fellowes Bankers Box Recycled Super Stor/Drawer,46.53
OFF-ST-10001476,Office Supplies,Storage,Steel Personal Filing/Posting Tote,33.53
OFF-ST-10001490,Office Supplies,Storage,"Hot File 7-Pocket, Floor Stand",29.53
OFF-ST-10001496,Office Supplies,Storage,Standard Rollaway File with Lock,31.53
OFF-ST-10001505,Office Supplies,Storage,"Perma STOR-ALL Hanging File Box, 13 1/8W x 12 1/4D x 10 1/2H",59.53
OFF-ST-10001511,Office Supplies,Storage,Space Solutions Commercial Steel Shelving,40.53
OFF-ST-10001522,Office Supplies,Storage,"Gould Plastics 18-Pocket Panel Bin, 34w x 5-1/4d x 20-1/2h",57.53
OFF-ST-10001526,Office Supplies,Storage,Iceberg Mobile Mega Data/Printer Cart ,37.53
OFF-ST-10001558,Office Supplies,Storage,Acco Perma 4000 Stacking Storage Drawers,39.53
OFF-ST-10001580,Office Supplies,Storage,Super Decoflex Portable Personal File,36.53
OFF-ST-10001590,Office Supplies,Storage,"Tenex Personal Project File with Scoop Front Design, Black",57.53
OFF-ST-10001627,Office Supplies,Storage,Eldon Jumbo ProFile Portable File Boxes Graphite/Black,53.53
OFF-ST-10001713,Office Supplies,Storage,"Gould Plastics 9-Pocket Panel Bin, 18-3/8w x 5-1/4d x 20-1/2h, Black",67.53
OFF-ST-10001780,Office Supplies,Storage,Tennsco 16-Compartment Lockers with Coat Rack,44.53
OFF-ST-10001809,Office Supplies,Storage,Fellowes Officeware Wire Shelving,32.53
OFF-ST-10001837,Office Supplies,Storage,"SAFCO Mobile Desk Side File, Wire Frame",38.53
OFF-ST-10001932,Office Supplies,Storage,Fellowes Staxonsteel Drawer Files,32.53
OFF-ST-10001963,Office Supplies,Storage,Tennsco Regal Shelving Units,27.53
OFF-ST-10002011,Office Supplies,Storage,Smead Adjustable Mobile File Trolley with Lockable Top,53.53
OFF-ST-10002182,Office Supplies,Storage,"Iris 3-Drawer Stacking Bin, Black",32.53
OFF-ST-10002205,Office Supplies,Storage,File Shuttle I and Handi-File,28.53
OFF-ST-10002214,Office Supplies,Storage,X-Rack File for Hanging Folders,30.53
OFF-ST-10002276,Office Supplies,Storage,Safco Steel Mobile File Cart,27.53
OFF-ST-10002289,Office Supplies,Storage,"Safco Wire Cube Shelving System, For Use as 4 or 5 14 Cubes, Black",65.53
OFF-ST-10002292,Office Supplies,Storage,"Sauder Facets Collection Locker/File Cabinet, Sky Alder Finish",61.53
OFF-ST-10002301,Office Supplies,Storage,Tennsco Commercial Shelving,26.53
OFF-ST-10002344,Office Supplies,Storage,Carina 42Hx23 3/4W Media Storage Unit,36.53
OFF-ST-10002352,Office Supplies,Storage,Iris Project Case,16.53
OFF-ST-10002370,Office Supplies,Storage,"Sortfiler Multipurpose Personal File Organizer, Black",52.53
OFF-ST-10002406,Office Supplies,Storage,Pizazz Global Quick File,23.53
OFF-ST-10002444,Office Supplies,Storage,Recycled Eldon Regeneration Jumbo File,37.53
OFF-ST-10002485,Office Supplies,Storage,Rogers Deluxe File Chest,23.53
OFF-ST-10002486,Office Supplies,Storage,Eldon Shelf Savers Cubes and Bins,32.53
OFF-ST-10002554,Office Supplies,Storage,Tennsco Industrial Shelving,26.53
OFF-ST-10002562,Office Supplies,Storage,Staple magnet,12.53
OFF-ST-10002574,Office Supplies,Storage,"SAFCO Commercial Wire Shelving, Black",36.53
OFF-ST-10002583,Office Supplies,Storage,Fellowes Neat Ideas Storage Cubes,32.53
OFF-ST-10002615,Office Supplies,Storage,"Dual Level, Single-Width Filing Carts",36.53
OFF-ST-10002743,Office Supplies,Storage,SAFCO Boltless Steel Shelving,28.53
OFF-ST-10002756,Office Supplies,Storage,"Tennsco Stur-D-Stor Boltless Shelving, 5 Shelves, 24 Deep, Sand",62.53
OFF-ST-10002790,Office Supplies,Storage,Safco Industrial Shelving,24.53
OFF-ST-10002957,Office Supplies,Storage,Sterilite Show Offs Storage Containers,37.53
OFF-ST-10002974,Office Supplies,Storage,"Trav-L-File Heavy-Duty Shuttle II, Black",39.53
OFF-ST-10003058,Office Supplies,Storage,Eldon Mobile Mega Data Cart  Mega Stackable  Add-On Trays,56.53
OFF-ST-10003123,Office Supplies,Storage,Fellowes Bases and Tops For Staxonsteel/High-Stak Systems,56.53
OFF-ST-10003208,Office Supplies,Storage,Adjustable Depth Letter/Legal Cart,33.53
OFF-ST-10003221,Office Supplies,Storage,Staple magnet,12.53
OFF-ST-10003282,Office Supplies,Storage,"Advantus 10-Drawer Portable Organizer, Chrome Metal Frame, Smoke Drawers",71.53
OFF-ST-10003306,Office Supplies,Storage,Letter Size Cart,15.53
OFF-ST-10003324,Office Supplies,Storage,Belkin OmniView SE Rackmount Kit,31.53
OFF-ST-10003327,Office Supplies,Storage,Akro-Mils 12-Gallon Tote,23.53
OFF-ST-10003442,Office Supplies,Storage,Eldon Portable Mobile Manager,28.53
OFF-ST-10003455,Office Supplies,Storage,"Tenex File Box, Personal Filing Tote with Lid, Black",51.53
OFF-ST-10003470,Office Supplies,Storage,"Tennsco Snap-Together Open Shelving Units, Starter Sets and Add-On Units",71.53
OFF-ST-10003479,Office Supplies,Storage,"Eldon Base for stackable storage shelf, platinum",47.53
OFF-ST-10003572,Office Supplies,Storage,Portfile Personal File Boxes,27.53
OFF-ST-10003638,Office Supplies,Storage,Mobile Personal File Cube,24.53
OFF-ST-10003641,Office Supplies,Storage,Space Solutions Industrial Galvanized Steel Shelving.,52.53
OFF-ST-10003656,Office Supplies,Storage,Safco Industrial Wire Shelving,29.53
OFF-ST-10003692,Office Supplies,Storage,Recycled Steel Personal File for Hanging File Folders,52.53
OFF-ST-10003716,Office Supplies,Storage,Tennsco Double-Tier Lockers,26.53
OFF-ST-10003722,Office Supplies,Storage,Project Tote Personal File,25.53
OFF-ST-10003805,Office Supplies,Storage,"24 Capacity Maxi Data Binder Racks, Pearl",40.53
OFF-ST-10003816,Office Supplies,Storage,Fellowes High-Stak Drawer Files,30.53
OFF-ST-10003994,Office Supplies,Storage,"Belkin 19 Center-Weighted Shelf, Gray",36.53
OFF-ST-10003996,Office Supplies,Storage,"Letter/Legal File Tote with Clear Snap-On Lid, Black Granite",59.53
OFF-ST-10004123,Office Supplies,Storage,Safco Industrial Wire Shelving System,36.53
OFF-ST-10004180,Office Supplies,Storage,Safco Commercial Shelving,24.53
OFF-ST-10004186,Office Supplies,Storage,"Stur-D-Stor Shelving, Vertical 5-Shelf: 72H x 36W x 18 1/2D",58.53
OFF-ST-10004258,Office Supplies,Storage,Portable Personal File Box,25.53
OFF-ST-10004337,Office Supplies,Storage,"SAFCO Commercial Wire Shelving, 72h",34.53
OFF-ST-10004340,Office Supplies,Storage,"Fellowes Mobile File Cart, Black",31.53
OFF-ST-10004459,Office Supplies,Storage,Tennsco Single-Tier Lockers,26.53
OFF-ST-10004507,Office Supplies,Storage,Advantus Rolling Storage Box,27.53
OFF-ST-10004634,Office Supplies,Storage,"Personal Folder Holder, Ebony",28.53
OFF-ST-10004804,Office Supplies,Storage,"Belkin 19 Vented Equipment Shelf, Black",38.53
OFF-ST-10004835,Office Supplies,Storage,Plastic Stacking Crates & Casters,32.53
OFF-ST-10004946,Office Supplies,Storage,Desktop 3-Pocket Hot File,24.53
OFF-ST-10004950,Office Supplies,Storage,Acco Perma 3000 Stacking Storage Drawers,39.53
OFF-ST-10004963,Office Supplies,Storage,Eldon Gobal File Keepers,23.53
OFF-SU-10000151,Office Supplies,Supplies,High Speed Automatic Electric Letter Opener,42.47
OFF-SU-10000157,Office Supplies,Supplies,Compact Automatic Electric Letter Opener,39.47
OFF-SU-10000381,Office Supplies,Supplies,Acme Forged Steel Scissors with Black Enamel Handles,51.47
OFF-SU-10000432,Office Supplies,Supplies,Acco Side-Punched Conventional Columnar Pads,43.47
OFF-SU-10000646,Office Supplies,Supplies,Premier Automatic Letter Opener,30.47
OFF-SU-10000898,Office Supplies,Supplies,"Acme Hot Forged Carbon Steel Scissors with Nickel-Plated Handles, 3 7/8 Cut, 8L",78.47
OFF-SU-10000946,Office Supplies,Supplies,Staple remover,13.47
OFF-SU-10000952,Office Supplies,Supplies,Fiskars Home & Office Scissors,29.47
OFF-SU-10001165,Office Supplies,Supplies,Acme Elite Stainless Steel Scissors,34.47
OFF-SU-10001212,Office Supplies,Supplies,Kleencut Forged Office Shears by Acme United Corporation,55.47
OFF-SU-10001218,Office Supplies,Supplies,Fiskars Softgrip Scissors,24.47
OFF-SU-10001225,Office Supplies,Supplies,Staple remover,13.47
OFF-SU-10001574,Office Supplies,Supplies,Acme Value Line Scissors,23.47
OFF-SU-10001664,Office Supplies,Supplies,Acme Office Executive Series Stainless Steel Trimmers,52.47
OFF-SU-10001935,Office Supplies,Supplies,Staple remover,13.47
OFF-SU-10002189,Office Supplies,Supplies,Acme Rosewood Handle Letter Opener,33.47
OFF-SU-10002301,Office Supplies,Supplies,Serrated Blade or Curved Handle Hand Letter Openers,50.47
OFF-SU-10002503,Office Supplies,Supplies,Acme Preferred Stainless Steel Scissors,38.47
OFF-SU-10002522,Office Supplies,Supplies,Acme Kleen Earth Office Shears,29.47
OFF-SU-10002537,Office Supplies,Supplies,Acme Box Cutter Scissors,23.47
OFF-SU-10002557,Office Supplies,Supplies,Fiskars Spring-Action Scissors,29.47
OFF-SU-10002573,Office Supplies,Supplies,Acme 10 Easy Grip Assistive Scissors,35.47
OFF-SU-10002881,Office Supplies,Supplies,Martin Yale Chadless Opener Electric Letter Opener,49.47
OFF-SU-10003002,Office Supplies,Supplies,Letter Slitter,13.47
OFF-SU-10003505,Office Supplies,Supplies,Premier Electric Letter Opener,29.47
OFF-SU-10003567,Office Supplies,Supplies,Stiletto Hand Letter Openers,27.47
OFF-SU-10003936,Office Supplies,Supplies,Acme Serrated Blade Letter Opener,32.47
OFF-SU-10004115,Office Supplies,Supplies,Acme Stainless Steel Office Snips,32.47
OFF-SU-10004231,Office Supplies,Supplies,Acme Tagit Stainless Steel Antibacterial Scissors,48.47
OFF-SU-10004261,Office Supplies,Supplies,"Fiskars 8 Scissors, 2/Pack",25.47
OFF-SU-10004290,Office Supplies,Supplies,"Acme Design Line 8 Stainless Steel Bent Scissors w/Champagne Handles, 3-1/8 Cut",78.47
OFF-SU-10004498,Office Supplies,Supplies,Martin-Yale Premier Letter Opener,32.47
OFF-SU-10004661,Office Supplies,Supplies,Acme Titanium Bonded Scissors,28.47
OFF-SU-10004664,Office Supplies,Supplies,Acme Softgrip Scissors,21.47
OFF-SU-10004737,Office Supplies,Supplies,Acme Design Stainless Steel Bent Scissors,40.47
OFF-SU-10004768,Office Supplies,Supplies,Acme Kleencut Forged Steel Scissors,34.47
OFF-SU-10004782,Office Supplies,Supplies,Elite 5 Scissors,15.47
OFF-SU-10004884,Office Supplies,Supplies,Acme Galleria Hot Forged Steel Scissors with Colored Handles,59.47
TEC-AC-10000023,Technology,Accessories,"Maxell 74 Minute CD-R Spindle, 50/Pack",36.90
TEC-AC-10000057,Technology,Accessories,Microsoft Natural Ergonomic Keyboard 4000,39.90
TEC-AC-10000109,Technology,Accessories,Sony Micro Vault Click 16 GB USB 2.0 Flash Drive,46.90
TEC-AC-10000158,Technology,Accessories,Sony 64GB Class 10 Micro SDHC R40 Memory Card,43.90
TEC-AC-10000171,Technology,Accessories,"Verbatim 25 GB 6x Blu-ray Single Layer Recordable Disc, 25/Pack",61.90
TEC-AC-10000199,Technology,Accessories,Kingston Digital DataTraveler 8GB USB 2.0,39.90
TEC-AC-10000290,Technology,Accessories,Sabrent 4-Port USB 2.0 Hub,24.90
TEC-AC-10000303,Technology,Accessories,Logitech M510 Wireless Mouse,26.90
TEC-AC-10000358,Technology,Accessories,Imation Secure Drive + Hardware Encrypted USB flash drive - 16 GB,63.90
TEC-AC-10000387,Technology,Accessories,KeyTronic KT800P2 - Keyboard - Black,34.90
TEC-AC-10000397,Technology,Accessories,"Perixx PERIBOARD-512B, Ergonomic Split Keyboard",45.90
TEC-AC-10000420,Technology,Accessories,Logitech G500s Laser Gaming Mouse with Adjustable Weight Tuning,61.90
TEC-AC-10000474,Technology,Accessories,Kensington Expert Mouse Optical USB Trackball for PC or Mac,57.90
TEC-AC-10000487,Technology,Accessories,SanDisk Cruzer 4 GB USB Flash Drive,33.90
TEC-AC-10000521,Technology,Accessories,"Verbatim Slim CD and DVD Storage Cases, 50/Pack",45.90
TEC-AC-10000580,Technology,Accessories,Logitech G13 Programmable Gameboard with LCD Display,50.90
TEC-AC-10000682,Technology,Accessories,Kensington K72356US Mouse-in-a-Box USB Desktop Mouse,50.90
TEC-AC-10000710,Technology,Accessories,Maxell DVD-RAM Discs,18.90
TEC-AC-10000736,Technology,Accessories,Logitech G600 MMO Gaming Mouse,28.90
TEC-AC-10000844,Technology,Accessories,Logitech Gaming G510s - Keyboard,30.90
TEC-AC-10000865,Technology,Accessories,WD My Passport Ultra 500GB Portable External Hard Drive,53.90
TEC-AC-10000892,Technology,Accessories,NETGEAR N750 Dual Band Wi-Fi Gigabit Router,41.90
TEC-AC-10000926,Technology,Accessories,NETGEAR RangeMax WNR1000 Wireless Router,38.90
TEC-AC-10000927,Technology,Accessories,Anker Ultrathin Bluetooth Wireless Keyboard Aluminum Cover with Stand ,68.90
TEC-AC-10000990,Technology,Accessories,Imation Bio 2GB USB Flash Drive Imation Corp,42.90
TEC-AC-10000991,Technology,Accessories,Sony Micro Vault Click 8 GB USB 2.0 Flash Drive,45.90
TEC-AC-10001013,Technology,Accessories,Logitech ClearChat Comfort/USB Headset H390,41.90
TEC-AC-10001090,Technology,Accessories,Micro Innovations Wireless Classic Keyboard with Mouse,52.90
TEC-AC-10001101,Technology,Accessories,Sony 16GB Class 10 Micro SDHC R40 Memory Card,43.90
TEC-AC-10001109,Technology,Accessories,Logitech Trackman Marble Mouse,28.90
TEC-AC-10001114,Technology,Accessories,Microsoft Wireless Mobile Mouse 4000,34.90
TEC-AC-10001142,Technology,Accessories,First Data FD10 PIN Pad,21.90
TEC-AC-10001266,Technology,Accessories,Memorex Micro Travel Drive 8 GB,29.90
TEC-AC-10001267,Technology,Accessories,Imation 32GB Pocket Pro USB 3.0 Flash Drive - 32 GB - Black - 1 P ...,67.90
TEC-AC-10001284,Technology,Accessories,Enermax Briskie RF Wireless Keyboard and Mouse Combo,50.90
TEC-AC-10001314,Technology,Accessories,Case Logic 2.4GHz Wireless Keyboard,33.90
TEC-AC-10001383,Technology,Accessories,Logitech Wireless Touch Keyboard K400,35.90
TEC-AC-10001432,Technology,Accessories,Enermax Aurora Lite Keyboard,26.90
TEC-AC-10001445,Technology,Accessories,Imation USB 2.0 Swivel Flash Drive USB flash drive - 4 GB - Pink,62.90
TEC-AC-10001465,Technology,Accessories,SanDisk Cruzer 64 GB USB Flash Drive,34.90
TEC-AC-10001539,Technology,Accessories,Logitech G430 Surround Sound Gaming Headset with Dolby 7.1 Technology,67.90
TEC-AC-10001542,Technology,Accessories,SanDisk Cruzer 16 GB USB Flash Drive,34.90
TEC-AC-10001552,Technology,Accessories,Logitech K350 2.4Ghz Wireless Keyboard,36.90
TEC-AC-10001553,Technology,Accessories,"Memorex 25GB 6X Branded Blu-Ray Recordable Disc, 15/Pack",54.90
TEC-AC-10001590,Technology,Accessories,Dell Slim USB Multimedia Keyboard,31.90
TEC-AC-10001606,Technology,Accessories,Logitech Wireless Performance Mouse MX for PC and Mac,51.90
TEC-AC-10001635,Technology,Accessories,KeyTronic KT400U2 - Keyboard - Black,34.90
TEC-AC-10001714,Technology,Accessories,Logitech MX Performance Wireless Mouse,36.90
TEC-AC-10001767,Technology,Accessories,SanDisk Ultra 64 GB MicroSDHC Class 10 Memory Card,48.90
TEC-AC-10001772,Technology,Accessories,Memorex Mini Travel Drive 16 GB USB 2.0 Flash Drive,49.90
TEC-AC-10001838,Technology,Accessories,Razer Tiamat Over Ear 7.1 Surround Sound PC Gaming Headset,56.90
TEC-AC-10001874,Technology,Accessories,Logitech Wireless Anywhere Mouse MX for PC and Mac,48.90
TEC-AC-10001908,Technology,Accessories,Logitech Wireless Headset h800,28.90
TEC-AC-10001956,Technology,Accessories,Microsoft Arc Touch Mouse,23.90
TEC-AC-10001990,Technology,Accessories,Kensington Orbit Wireless Mobile Trackball for PC and Mac,55.90
TEC-AC-10001998,Technology,Accessories,Logitech LS21 Speaker System - PC Multimedia - 2.1-CH - Wired,59.90
TEC-AC-10002001,Technology,Accessories,Logitech Wireless Gaming Headset G930,35.90
TEC-AC-10002006,Technology,Accessories,Memorex Micro Travel Drive 16 GB,30.90
TEC-AC-10002018,Technology,Accessories,AmazonBasics 3-Button USB Wired Mouse,35.90
TEC-AC-10002049,Technology,Accessories,Logitech G19 Programmable Gaming Keyboard,39.90
TEC-AC-10002076,Technology,Accessories,Microsoft Natural Keyboard Elite,30.90
TEC-AC-10002134,Technology,Accessories,Rosewill 107 Normal Keys USB Wired Standard Keyboard,50.90
TEC-AC-10002167,Technology,Accessories,Imation 8gb Micro Traveldrive Usb 2.0 Flash Drive,47.90
TEC-AC-10002217,Technology,Accessories,Imation Clip USB flash drive - 8 GB,33.90
TEC-AC-10002253,Technology,Accessories,Imation Bio 8GB USB Flash Drive Imation Corp,42.90
TEC-AC-10002305,Technology,Accessories,KeyTronic E03601U1 - Keyboard - Beige,35.90
TEC-AC-10002323,Technology,Accessories,SanDisk Ultra 32 GB MicroSDHC Class 10 Memory Card,48.90
TEC-AC-10002331,Technology,Accessories,"Maxell 74 Minute CDR, 10/Pack",27.90
TEC-AC-10002335,Technology,Accessories,Logitech Media Keyboard K200,26.90
TEC-AC-10002345,Technology,Accessories,HP Standard 104 key PS/2 Keyboard,31.90
TEC-AC-10002370,Technology,Accessories,Maxell CD-R Discs,15.90
TEC-AC-10002380,Technology,Accessories,Sony 8GB Class 10 Micro SDHC R40 Memory Card,42.90
TEC-AC-10002399,Technology,Accessories,SanDisk Cruzer 32 GB USB Flash Drive,34.90
TEC-AC-10002402,Technology,Accessories,Razer Kraken PRO Over Ear PC and Music Headset,44.90
TEC-AC-10002473,Technology,Accessories,Maxell 4.7GB DVD-R,16.90
TEC-AC-10002550,Technology,Accessories,Maxell 4.7GB DVD-RW 3/Pack,24.90
TEC-AC-10002558,Technology,Accessories,Imation Swivel Flash Drive USB flash drive - 8 GB,47.90
TEC-AC-10002567,Technology,Accessories,Logitech G602 Wireless Gaming Mouse,33.90
TEC-AC-10002600,Technology,Accessories,Belkin QODE FastFit Bluetooth Keyboard,36.90
TEC-AC-10002637,Technology,Accessories,Logitech VX Revolution Cordless Laser Mouse for Notebooks (Black),63.90
TEC-AC-10002647,Technology,Accessories,"Logitech Wireless Boombox Speaker - portable - wireless, wired",60.90
TEC-AC-10002718,Technology,Accessories,Belkin Standard 104 key USB Keyboard,34.90
TEC-AC-10002800,Technology,Accessories,Plantronics Audio 478 Stereo USB Headset,38.90
TEC-AC-10002842,Technology,Accessories,WD My Passport Ultra 2TB Portable External Hard Drive,51.90
TEC-AC-10002857,Technology,Accessories,"Verbatim 25 GB 6x Blu-ray Single Layer Recordable Disc, 1/Pack",60.90
TEC-AC-10002926,Technology,Accessories,Logitech Wireless Marathon Mouse M705,35.90
TEC-AC-10002942,Technology,Accessories,WD My Passport Ultra 1TB Portable External Hard Drive,51.90
TEC-AC-10003023,Technology,Accessories,Logitech G105 Gaming Keyboard,27.90
TEC-AC-10003027,Technology,Accessories,Imation 8GB Mini TravelDrive USB 2.0 Flash Drive,46.90
TEC-AC-10003033,Technology,Accessories,Plantronics CS510 - Over-the-Head monaural Wireless Headset System,64.90
TEC-AC-10003038,Technology,Accessories,Kingston Digital DataTraveler 16GB USB 2.0,40.90
TEC-AC-10003063,Technology,Accessories,Micro Innovations USB RF Wireless Keyboard with Mouse,51.90
TEC-AC-10003095,Technology,Accessories,Logitech G35 7.1-Channel Surround Sound Headset,45.90
TEC-AC-10003116,Technology,Accessories,Memorex Froggy Flash Drive 8 GB,29.90
TEC-AC-10003133,Technology,Accessories,Memorex Mini Travel Drive 4 GB USB 2.0 Flash Drive,48.90
TEC-AC-10003174,Technology,Accessories,Plantronics S12 Corded Telephone Headset System,45.90
TEC-AC-10003198,Technology,Accessories,Enermax Acrylux Wireless Keyboard,31.90
TEC-AC-10003237,Technology,Accessories,Memorex Micro Travel Drive 4 GB,29.90
TEC-AC-10003280,Technology,Accessories,Belkin F8E887 USB Wired Ergonomic Keyboard,40.90
TEC-AC-10003289,Technology,Accessories,Anker Ultra-Slim Mini Bluetooth 3.0 Wireless Keyboard,51.90
TEC-AC-10003399,Technology,Accessories,Memorex Mini Travel Drive 64 GB USB 2.0 Flash Drive,49.90
TEC-AC-10003433,Technology,Accessories,Maxell 4.7GB DVD+R 5/Pack,23.90
TEC-AC-10003441,Technology,Accessories,Kingston Digital DataTraveler 32GB USB 2.0,40.90
TEC-AC-10003447,Technology,Accessories,Micropad Numeric Keypads,22.90
TEC-AC-10003499,Technology,Accessories,Memorex Mini Travel Drive 8 GB USB 2.0 Flash Drive,48.90
TEC-AC-10003590,Technology,Accessories,"TRENDnet 56K USB 2.0 Phone, Internet and Fax Modem",48.90
TEC-AC-10003610,Technology,Accessories,Logitech Illuminated - Keyboard,29.90
TEC-AC-10003614,Technology,Accessories,"Verbatim 25 GB 6x Blu-ray Single Layer Recordable Disc, 10/Pack",61.90
TEC-AC-10003628,Technology,Accessories,Logitech 910-002974 M325 Wireless Mouse for Web Scrolling,55.90
TEC-AC-10003657,Technology,Accessories,Lenovo 17-Key USB Numeric Keypad,30.90
TEC-AC-10003709,Technology,Accessories,Maxell 4.7GB DVD-R 5/Pack,23.90
TEC-AC-10003832,Technology,Accessories,Logitech P710e Mobile Speakerphone,32.90
TEC-AC-10003870,Technology,Accessories,Logitech Z-906 Speaker sys - home theater - 5.1-CH,48.90
TEC-AC-10003911,Technology,Accessories,NETGEAR AC1750 Dual Band Gigabit Smart WiFi Router,48.90
TEC-AC-10004001,Technology,Accessories,Logitech Wireless Headset H600 Over-The-Head Design,49.90
TEC-AC-10004114,Technology,Accessories,KeyTronic 6101 Series - Keyboard - Black,38.90
TEC-AC-10004127,Technology,Accessories,SanDisk Cruzer 8 GB USB Flash Drive,33.90
TEC-AC-10004145,Technology,Accessories,Logitech diNovo Edge Keyboard,27.90
TEC-AC-10004171,Technology,Accessories,Razer Kraken 7.1 Surround Sound Over Ear USB Gaming Headset,57.90
TEC-AC-10004209,Technology,Accessories,Memorex Froggy Flash Drive 4 GB,29.90
TEC-AC-10004227,Technology,Accessories,SanDisk Ultra 16 GB MicroSDHC Class 10 Memory Card,48.90
TEC-AC-10004353,Technology,Accessories,Hypercom P1300 Pinpad,19.90
TEC-AC-10004396,Technology,Accessories,Logitech Keyboard K120,20.90
TEC-AC-10004420,Technology,Accessories,Cherry 142-key Programmable Keyboard,34.90
TEC-AC-10004469,Technology,Accessories,Microsoft Sculpt Comfort Mouse,28.90
TEC-AC-10004510,Technology,Accessories,Logitech Desktop MK120 Mouse and keyboard Combo,45.90
TEC-AC-10004518,Technology,Accessories,Memorex Mini Travel Drive 32 GB USB 2.0 Flash Drive,49.90
TEC-AC-10004568,Technology,Accessories,Maxell LTO Ultrium - 800 GB,25.90
TEC-AC-10004571,Technology,Accessories,Logitech G700s Rechargeable Gaming Mouse,38.90
TEC-AC-10004595,Technology,Accessories,First Data TMFD35 PIN Pad,23.90
TEC-AC-10004633,Technology,Accessories,"Verbatim 25 GB 6x Blu-ray Single Layer Recordable Disc, 3/Pack",60.90
TEC-AC-10004659,Technology,Accessories,Imation Secure+ Hardware Encrypted USB 2.0 Flash Drive; 16GB,58.90
TEC-AC-10004666,Technology,Accessories,Maxell iVDR EX 500GB Cartridge,28.90
TEC-AC-10004708,Technology,Accessories,Sony 32GB Class 10 Micro SDHC R40 Memory Card,43.90
TEC-AC-10004761,Technology,Accessories,Maxell 4.7GB DVD+RW 3/Pack,24.90
TEC-AC-10004803,Technology,Accessories,Sony Micro Vault Click 4 GB USB 2.0 Flash Drive,45.90
TEC-AC-10004814,Technology,Accessories,Logitech Illuminated Ultrathin Keyboard with Backlighting,55.90
TEC-AC-10004855,Technology,Accessories,V7 USB Numeric Keypad,19.90
TEC-AC-10004859,Technology,Accessories,"Maxell Pro 80 Minute CD-R, 10/Pack",32.90
TEC-AC-10004864,Technology,Accessories,Memorex Micro Travel Drive 32 GB,30.90
TEC-AC-10004877,Technology,Accessories,Imation 30456 USB Flash Drive 8GB,31.90
TEC-AC-10004901,Technology,Accessories,Kensington SlimBlade Notebook Wireless Mouse with Nano Receiver ,62.90
TEC-AC-10004975,Technology,Accessories,Plantronics Audio 995 Wireless Stereo Headset,43.90
TEC-AC-10004992,Technology,Accessories,Kingston Digital DataTraveler 64GB USB 2.0,40.90
TEC-CO-10000971,Technology,Copiers,Hewlett Packard 310 Color Digital Copier,39.30
TEC-CO-10001046,Technology,Copiers,Canon Imageclass D680 Copier / Fax,33.30
TEC-CO-10001449,Technology,Copiers,Hewlett Packard LaserJet 3310 Copier,35.30
TEC-CO-10001571,Technology,Copiers,Sharp 1540cs Digital Laser Copier,32.30
TEC-CO-10001766,Technology,Copiers,Canon PC940 Copier,17.30
TEC-CO-10001943,Technology,Copiers,Canon PC-428 Personal Copier,27.30
TEC-CO-10002095,Technology,Copiers,Hewlett Packard 610 Color Digital Copier / Printer,49.30
TEC-CO-10002313,Technology,Copiers,Canon PC1080F Personal Copier,28.30
TEC-CO-10003236,Technology,Copiers,Canon Image Class D660 Copier,28.30
TEC-CO-10003763,Technology,Copiers,Canon PC1060 Personal Laser Copier,33.30
TEC-CO-10004115,Technology,Copiers,Sharp AL-1530CS Digital Copier,29.30
TEC-CO-10004202,Technology,Copiers,Brother DCP1000 Digital 3 in 1 Multifunction Machine,51.30
TEC-CO-10004722,Technology,Copiers,Canon imageCLASS 2200 Advanced Copier,36.30
TEC-MA-10000010,Technology,Machines,Hewlett-Packard Deskjet 3050a All-in-One Color Inkjet Printer,60.20
TEC-MA-10000029,Technology,Machines,"Epson WorkForce WF-2530 All-in-One Printer, Copier Scanner",57.20
TEC-MA-10000045,Technology,Machines,Zebra ZM400 Thermal Label Printer,32.20
TEC-MA-10000112,Technology,Machines,Panasonic KX MB2061 Multifunction Printer,40.20
TEC-MA-10000418,Technology,Machines,Cubify CubeX 3D Printer Double Head Print,40.20
TEC-MA-10000423,Technology,Machines,Texas Instruments TI-34 Scientific Calculator,44.20
TEC-MA-10000488,Technology,Machines,Bady BDG101FRU Card Printer,26.20
TEC-MA-10000597,Technology,Machines,Lexmark S315 Color Inkjet Printer,32.20
TEC-MA-10000752,Technology,Machines,Texas Instrument TI-15 Fraction Calculator,41.20
TEC-MA-10000822,Technology,Machines,Lexmark MX611dhe Monochrome Laser Printer,40.20
TEC-MA-10000864,Technology,Machines,Cisco 9971 IP Video Phone Charcoal,33.20
TEC-MA-10000904,Technology,Machines,"Brother MFC-9340CDW LED All-In-One Printer, Copier Scanner",57.20
TEC-MA-10000984,Technology,Machines,Okidata MB760 Printer,20.20
TEC-MA-10001016,Technology,Machines,Canon PC170 Desktop Personal Copier,34.20
TEC-MA-10001031,Technology,Machines,Socket Bluetooth Cordless Hand Scanner (CHS),43.20
TEC-MA-10001047,Technology,Machines,"3D Systems Cube Printer, 2nd Generation, Magenta",47.20
TEC-MA-10001127,Technology,Machines,HP Designjet T520 Inkjet Large Format Printer - 24 Color,55.20
TEC-MA-10001148,Technology,Machines,Swingline SM12-08 MicroCut Jam Free Shredder,43.20
TEC-MA-10001570,Technology,Machines,Cisco Desktop Collaboration Experience DX650 IP Video Phone,58.20
TEC-MA-10001681,Technology,Machines,Lexmark MarkNet N8150 Wireless Print Server,42.20
TEC-MA-10001695,Technology,Machines,Zebra GK420t Direct Thermal/Thermal Transfer Printer,51.20
TEC-MA-10001856,Technology,Machines,Okidata C610n Printer,20.20
